id_producto,productos_descripcion,barcode_formats,mpn,model,asin,title,category,manufacturer,brand,contributors,age_group,ingredients,nutrition_facts,energy_efficiency_class,color,gender,material,pattern,format,multipack,size,length,width,height,weight,release_date,description,features,images,last_update,stores,reviews
1111118,KONIGSBACHER CERVEZA ALEMANA DE TRIGO ,EAN-8 01111118,TRB-9HS-CS-S,22010,B00949CTQQ,Arroyo Craftsman Timber Ridge 13 Inch Tall 1 Light Outdoor Wall Light Timber Ridge - TRB-9HS-CS-S - Rustic,,Capitol Lighting,Capitol Lighting,[],,,,,,,,,,1.0,4 Fl Oz (Pack of 1),1.5748 in,1.5748 in,5.5118 in,0.24912235606 lb,,Timber Ridge 13 Inch Tall 1 Light Outdoor Wall Light by Arroyo Craftsman Timber Ridge Outdoor Wall Light by Arroyo Craftsman - TRB-9HS-CS-S.,"['GENTLE NON-ABRASIVE LEAVE-ON EXFOLIATOR: with 2% BHA (Beta hydroxy acid) to unclog & diminish enlarged pores, exfoliate dead skin cells, smooth wrinkles & brighten & even out skin tone. Combats redness, wrinkles, aging, enlarged pores, & blackheads. PACKAGING MAY VARY.', ""Dramatically improves skin's texture for radiant youthful even-toned skin. Beta hydroxy acid (BHA also known as salicylic acid) mimics the natural exfoliation process of younger skin by helping it shed extra layers while unclogging and clearing pores."", 'HYDRATE, BRIGHTEN & SMOOTH FINE LINES: Our unique, non-abrasive, leave-on exfoliant is gentle enough for daily use on all skin types. Exfoliates dead skin cells while clearing pores for a more even tone, plus it visibly reduces fine lines & wrinkles.', ""Paula's Choice facial exfoliants are gentler on delicate skin of the face & neck than an abrasive face scrub, which can cause micro-tears. A BHA leave-on exfoliator delivers hydration & can exfoliate directly inside the pore & improve how the pore works."", ""Paula's Choice Skincare makes products that work. No fragrance, no parabens, no fluff. Just effective, science-backed formulas that target any concern from wrinkles to breakouts.""]","['https://images.barcodelookup.com/32715/327152221-1.jpg', 'https://images.barcodelookup.com/32715/327152221-2.jpg', 'https://images.barcodelookup.com/32715/327152221-3.jpg', 'https://images.barcodelookup.com/32715/327152221-4.jpg', 'https://images.barcodelookup.com/32715/327152221-5.jpg', 'https://images.barcodelookup.com/32715/327152221-6.jpg', 'https://images.barcodelookup.com/32715/327152221-7.jpg', 'https://images.barcodelookup.com/32715/327152221-8.jpg', 'https://images.barcodelookup.com/32715/327152221-9.jpg']",2024-06-23 20:03:49,[],[]
3456217,Cerveza MILLER Genuine Draft 330CC BOT-0.33-lt.,EAN-8 03456217,PC-100,,B079H53D2B,Genuine Draft,"Food, Beverages & Tobacco","JB7, LLC",Miller,[],,,,,,,,,,1.0,12 FL. OZ. 355mL,4.5 in,2.4 in,2.4 in,90 g,,"Genuine Draft. Labels: Kosher, No additives, Orthodox Union Kosher. Country of origin: United States.","['60 Billion Cfus Max Strength: Our probiotic actually contains 60 Billion Cfus per serving. Other brands claim it, but beware of deception. Some products say ""equivalent to"" or do not state an amount of Cfus. We saw a need for high-quality supplements that actually work and stand by their claims. Our most popular probiotic brings you exactly what\'s on the label with 10 probiotic strains, 60 Billion Cfu, and an organic prebiotic blend.', 'Probiotics and Organic Prebiotics: Our probiotics are made with prebiotics and probiotics based on clinical research. A complete probiotic supplement for ultimate digestive health. Made with 10 probiotic strains & Non-Gmo ingredients. Shelf-stable vegan probiotics with No: unnecessary binders, soy, gluten, milk, egg, wheat, peanuts, shellfish or preservatives.', ""Naturally Inspired Probiotic Supplement: Contains 10 strains plus a Patented Shelf-Stable bottle which ensures product stability. Our probiotic daily blend plus organic prebiotic fiber blend naturally helps to support the stomach's digestive environment and supports the natural stomach balance. Great for gut health, and occasional gas relief, bloating relief, constipation, digestive health and intestinal health."", 'Probiotics for Adults: Our prebiotics and probiotics are effective and intended for use by adults. Acidophilus probiotic with prebiotic including 10 strains: Lactobacillus acidophilus, Lactobacillus casei, Lactobacillus paracasei, Lactobacillus salivarius, Lactobacillus plantarum, Bifidobacterium lactis, Bifidobacterium bifidum, Bifidobacterium longum, Bifidobacterium breve, Lactobacillus bulgaricus.', 'Safety Assured Standard of Quality: Our 60 Billion Probiotic is 3rd-party tested for purity and potency. Each bottle is manufactured in the USA using imported and domestic ingredients. Our probiotics are made for women and men. They contain 60 Billion Cfus at the time of manufacturing, more than the usual 50 Billion Cfu, plus our standard organic prebiotic blend!']","['https://images.barcodelookup.com/29822/298220109-1.jpg', 'https://images.barcodelookup.com/29822/298220109-2.jpg', 'https://images.barcodelookup.com/29822/298220109-3.jpg', 'https://images.barcodelookup.com/29822/298220109-4.jpg', 'https://images.barcodelookup.com/29822/298220109-5.jpg', 'https://images.barcodelookup.com/29822/298220109-6.jpg', 'https://images.barcodelookup.com/29822/298220109-7.jpg']",2024-06-23 17:52:32,[],[]
75001629,cerveza SOL Rubia 330cc BOT-330-cc.,EAN-8 75001629,43687,43687,B07GN2H5BS,Sol,"Food, Beverages & Tobacco","Duracell Distributing, Inc",Sol,[],,"Eau,malt,houblon,levures",Energy 40 kcal.,,,,,,,,33 cl,0.25 in,1.75 in,3.5 in,,2018-08-16,"Sol. Allergens: En:gluten. Labels: Déconseillé à certaines catégories de personnes, Point Vert, Non recommandé aux femmes enceintes, Recycle, Tidyman Wastebasket, no:Skatteklasse D. Country of origin: Australia,France,Guadeloupe,Italy,Netherlands,Norway,Sweden,Switzerland,United Kingdom.","[""Lithium Coin Battery: Duracell's 1620 3V coin batteries provide reliable, long lasting power for your medical devices, watches, toys, fitness devices, security devices, electronics and more."", 'Long Lasting Power: Duracell coin batteries are engineered for long lasting performance.', 'Child-Resistant Packaging: To help ensure the safety of your children, Duracell Lithium Coin batteries come in a child-resistant package.', 'For 10 years in Storage: Duracell Lithium Coin batteries are for 10 years in storage.', 'This Duracell 1620 lithium coin battery is equivalent to DL1620 and CR1620.']","['https://images.barcodelookup.com/32405/324052980-1.jpg', 'https://images.barcodelookup.com/32405/324052980-2.jpg', 'https://images.barcodelookup.com/32405/324052980-3.jpg', 'https://images.barcodelookup.com/32405/324052980-4.jpg', 'https://images.barcodelookup.com/32405/324052980-5.jpg', 'https://images.barcodelookup.com/32405/324052980-6.jpg', 'https://images.barcodelookup.com/32405/324052980-7.jpg']",2024-06-23 19:52:56,[],[]
75032715,cerveza CORONA Rubia 330cc BOT-330-cc.,EAN-8 75032715,LiCB-CR2032-10,LiCB-CR2032-10,B071D4DKTZ,Corona Extra,"Food, Beverages & Tobacco",LiCB,Corona,[],,"Agua, Malta De Cebada, MaÍz, Arroz, LÚpulo. Antioxidante (e300).",Energy 42 kcal (176 kJ).,,cr2032 10pack,,,,,,355 cm3/ 355 ml,,,,0.0661386786 lb,,"Corona Extra. Serving size: 355 ml. Allergens: En:gluten. Labels: Kosher, No recomendado para ciertas personas, en:Contains alcohol, Punto Verde, Hecho en México, Desaconsejado para embarazadas, Unión Ortodoxa Kosher, en:A-votre-service. Country of origin: Argentina,Australia,Bolivia,France,Mexico,Singapore,Spain,Uruguay.","['★High Quality: Tested under Strict Quality Control Standards. CE and ROHS Certified. Grade A cells CR2032 Ensure Longer Battery Life and Long Lasting Power', '★Get the Exact Fresh CR2032 Battery, Have Full 3 Volts Charge, 3 Years Shelf Life', '★Primarily used in Watches, Computer motherboards, Calculators, PDAs, Electronic organizers, Garage door openers, Toys, Games, MP3 players, Digital voice recorders, Door chimes, Pet collars, LED lights, Sporting goods, Pedometers, Calorie counters, Stopwatches, Glucometers, Medical devices, and more', '★If your device uses any of the following batteries, this is what you are looking for.:Energizer CR2032，CR2032BP，DL2032，ECR2032，KCR2032，BR2032，LM2032,5004LC，5004LB，L14，SB-T15，EA2032C，EA-2032C，L2032,2032，DJ2032，KL2032，E- CR2032，KECR2032，GPCR2032，KT-CR2032', '★What You Get: 10PCS CR2032 Batteries in Exact Blister Pack']","['https://images.barcodelookup.com/28021/280210838-1.jpg', 'https://images.barcodelookup.com/28021/280210838-2.jpg', 'https://images.barcodelookup.com/28021/280210838-3.jpg', 'https://images.barcodelookup.com/28021/280210838-4.jpg', 'https://images.barcodelookup.com/28021/280210838-5.jpg', 'https://images.barcodelookup.com/28021/280210838-6.jpg']",2024-06-23 16:43:16,[],[]
656750797167,CERVEZA BOCATOMA AMERICAN AMB ,,,,,,,,,,,,,,,,,,,,,,,,,,,,,,,
656750797174,CERVEZA BOCATOMA SESSION IPA  ,,,,,,,,,,,,,,,,,,,,,,,,,,,,,,,
656750817315,cerveza ORTUZAR Golden 473cc LAT-0.473-lt.,,,,,,,,,,,,,,,,,,,,,,,,,,,,,,,
656750817322,cerveza ORTUZAR Scottish 473cc LAT-0.473-lt.,,,,,,,,,,,,,,,,,,,,,,,,,,,,,,,
656750817339,cerveza ORTUZAR Honey 473cc LAT-0.473-lt.,,,,,,,,,,,,,,,,,,,,,,,,,,,,,,,
656750817346,cerveza ORTUZAR German Pils 473cc LAT-0.473-lt.,,,,,,,,,,,,,,,,,,,,,,,,,,,,,,,
656750817353,cerveza ORTUZAR Porter 473cc LAT-0.473-lt.,,,,,,,,,,,,,,,,,,,,,,,,,,,,,,,
656750817360,cerveza ORTUZAR Dubbel 473cc LAT-0.473-lt.,,,,,,,,,,,,,,,,,,,,,,,,,,,,,,,
656750817377,cerveza ORTUZAR Ipa 473cc LAT-0.473-lt.,,,,,,,,,,,,,,,,,,,,,,,,,,,,,,,
656750817384,CERVEZA POKER C/BOURBON ORTUZAR LAT 473 ML,,,,,,,,,,,,,,,,,,,,,,,,,,,,,,,
790757845794,CERVEZA HONEY,,,,,,,,,,,,,,,,,,,,,,,,,,,,,,,
3162330450010,CERVEZA LAGER STARBERG LAT 500 ML,EAN-13 3162330450010,,,,Starberg-beer-500ml-france,"Food, Beverages & Tobacco",,,[],,,,,,,,,,,50 cl,,,,,,Starberg-beer-500ml-france. Country of origin: France.,[],['https://images.barcodelookup.com/81709/817090096-1.jpg'],2023-10-23 06:33:04,[],[]
4002631022679,CERVEZA EN LATA,EAN-13 4002631022679,,,,Cerveza,"Food, Beverages & Tobacco",,St. Wendeler,[],,"Agua, Malta De Cebada, Extracto De Lúpulo",,,,,,,,,500ml,,,,,,Cerveza. Country of origin: Argentina.,[],['https://images.barcodelookup.com/81753/817537220-1.jpg'],2023-10-24 05:55:36,[],[]
4002631022792,CERVEZA ALEMANA,EAN-13 4002631022792,,,,St. Wendeler Pils,"Food, Beverages & Tobacco",,Brautradition,[],,"Eau, Malt D'_orge_, Extrait De Houblon.",,,,,,,,,33 cl,,,,,,St. Wendeler Pils. Allergens: En:gluten. Country of origin: France.,[],"['https://images.barcodelookup.com/81753/817537223-1.jpg', 'https://images.barcodelookup.com/81753/817537223-2.jpg', 'https://images.barcodelookup.com/81753/817537223-3.jpg']",2023-10-24 05:55:36,[],[]
4002631024147,CERVEZA NEGRA BLACK,,,,,,,,,,,,,,,,,,,,,,,,,,,,,,,
4002631024161,CERVEZA LAGER,,,,,,,,,,,,,,,,,,,,,,,,,,,,,,,
4002631024192,CERVEZA TRIGO,,,,,,,,,,,,,,,,,,,,,,,,,,,,,,,
4015042107866,CERVEZA PILSENER MECKLENBURGER X 500 CC.,EAN-13 4015042107866,55842 0 0 U,,,Cerveja Premium Classic Pilsener Mecklenburger 500Ml,,Dunkel Mecklenburger,Dunkel Mecklenburger,[],,,,,,,,,,,,,,,,,"A mecklenburger pilsener é uma cerveja com aroma agradável, fresco e suave com um toque de lúpulos aromáticos bem selecionados. a água utilizada para esta cerveja vem do próprio poço da cervejaria e é cristalina. isso em combinação com a melhor seleção de malte de cevada e lúpulo dá uma cerveja de alta qualidade.",[],['https://images.barcodelookup.com/65749/657495135-1.jpg'],2023-05-15 17:15:54,[],[]
4015042108818,CERVEZA WEIBIER TRIGO MECKLENBURGER X 500 CC,EAN-13 4015042108818,55837 0 0 U,,,Mecklenburger,"Food, Beverages & Tobacco",Dunkel Mecklenburger,Dunkel Mecklenburger,[],,,,,,,,,,,,,,,,,Mecklenburger. Country of origin: Italy.,[],['https://images.barcodelookup.com/65749/657495279-1.jpg'],2023-10-24 03:02:45,[],[]
4015042111085,CERVEZA PILSENER MECKLENBURGER X 330 CC,,,,,,,,,,,,,,,,,,,,,,,,,,,,,,,
4015042111214,CERVEZA DUNKEL MECKLENBURGER X 500 CC,EAN-13 4015042111214,55830_0_0_U,,,Cerveja Premium Dunkel Mecklenburger 500Ml,,Dunkel Mecklenburger,Dunkel Mecklenburger,[],,,,,,,,,,,,,,,,,"A mecklenburger dunkel é uma cerveja suave, com sabores de caramelo e malte torrado. perfeita durante todo o inverno. a água utilizada para esta cerveja vem do próprio poço da cervejaria e é cristalina. isso em combinação com a melhor seleção de malte de cevada e lúpulo dá uma cerveja de alta qualidade.",[],['https://images.barcodelookup.com/53365/533657185-1.jpg'],2023-12-05 20:23:18,[],[]
4015042111641,CERVEZA IPA MECKLENBURGER X 500 CC,EAN-13 4015042111641,55832_0_0_U,,,Cerveja Premium Ipa Mecklenburger 500Ml,,Dunkel Mecklenburger,Dunkel Mecklenburger,[],,,,,,,,,,,,,,,,,A mecklenburger ipa é uma cerveja refrescante e suavidade. outra ótima lager para o verão. a água utilizada para esta cerveja vem do próprio poço da cervejaria e é cristalina. isso em combinação com a melhor seleção de malte de cevada e lúpulo dá uma cerveja de alta qualidade.,[],['https://images.barcodelookup.com/53365/533657538-1.jpg'],2023-12-05 20:23:21,[],[]
5410228141266,cerveza STELLA ARTOIS 330cc porrón BOT-330-cc.,EAN-13 5410228141266,,,,Beer,"Food, Beverages & Tobacco",,Stella Artois,[],,"Water, Barley Malt, Hops, Alcohol",,,,,,,,,330ml,,,,,,"Beer. Allergens: En:gluten. Labels: No recomendado para ciertas personas, Desaconsejado para embarazadas. Country of origin: Canada,France,Germany.",[],['https://images.barcodelookup.com/52381/523819854-1.jpg'],2023-10-19 10:02:37,"[{'name': 'Auchan PRM _PT', 'country': 'EU', 'currency': 'EUR', 'currency_symbol': '€', 'price': '1.99', 'sale_price': '', 'tax': [], 'link': 'https://www.auchan.pt/pt/bebidas-e-garrafeira/cervejas/cerveja-estrangeira/cerveja-stela-artois-belgica-0.33l/323900.html', 'item_group_id': '', 'availability': 'in stock', 'condition': '', 'shipping': [], 'last_update': '2022-10-18 07:48:24'}, {'name': 'Auchan Retail Portugal', 'country': 'EU', 'currency': 'EUR', 'currency_symbol': '€', 'price': '2.19', 'sale_price': '', 'tax': [], 'link': 'https://www.auchan.pt/pt/bebidas-e-garrafeira/cervejas-e-sidras/cerveja-estrangeira/cerveja-stella-artois-belgica-0.33l/323900.html?utm_campaign=&utm_content=&utm_source=aw&utm_medium=affiliate_feed&utm_term=', 'item_group_id': '', 'availability': 'in stock', 'condition': '', 'shipping': [], 'last_update': '2025-04-13 13:18:28'}]",[]
5701598035706,CERVEZA WHEAT BEAR BEER LATA 500 CC,,,,,,,,,,,,,,,,,,,,,,,,,,,,,,,
5701598036031,CERVEZA LAGER BEAR BEER LATA 500 CC,,,,,,,,,,,,,,,,,,,,,,,,,,,,,,,
5711018037067,CERVEZA SIN ALCOHOL MECKLENBURGER X 500 CC,,,,,,,,,,,,,,,,,,,,,,,,,,,,,,,
7020020075539,VASO CERVEZA FREVO NADIR 320ml,,,,,,,,,,,,,,,,,,,,,,,,,,,,,,,
7051020098129,VASO CERVEZA STOUT NADIR 473ml,,,,,,,,,,,,,,,,,,,,,,,,,,,,,,,
7501064106859,cerveza CORONA Rubia 710cc BOT-710-cc.,,,,,,,,,,,,,,,,,,,,,,,,,,,,,,,
7501064198847,cerveza CORONA Rubia 330cc BOT-330-cc.,,,,,,,,,,,,,,,,,,,,,,,,,,,,,,,
7651020096233,COPA CERVEZA DUBLIN NADIR 400ml,,,,,,,,,,,,,,,,,,,,,,,,,,,,,,,
7791001010794,BIFERDIL CHAMPU CERVEZA MIEL 250 ML,,,,,,,,,,,,,,,,,,,,,,,,,,,,,,,
7791720040010,CERVEZA RUBIA APOLO PET X 1 LT,,,,,,,,,,,,,,,,,,,,,,,,,,,,,,,
7791822688714,COPA CERVEZA NORUEGA 420cc,,,,,,,,,,,,,,,,,,,,,,,,,,,,,,,
7792798000395,cerveza BRAHMA Chopp 340cc Ret BOT-340-cc.,,,,,,,,,,,,,,,,,,,,,,,,,,,,,,,
7792798000425,cerveza NORTE Blanca BOT-1-lt.,,,,,,,,,,,,,,,,,,,,,,,,,,,,,,,
7792798000708,cerveza IGUANA Pilsener 1lt Ret BOT-1-lt.,,,,,,,,,,,,,,,,,,,,,,,,,,,,,,,
7792798000838,CERVEZA BRAHMA QAZUL 1000cc,,,,,,,,,,,,,,,,,,,,,,,,,,,,,,,
7792798001101,cerveza PATAGONIA Ipa Sauco OW 730cc BOT-730-ml.,,,,,,,,,,,,,,,,,,,,,,,,,,,,,,,
7792798001293,cerveza STELLA ARTOIS Rubia 473cc LAT-473-cc.,,,,,,,,,,,,,,,,,,,,,,,,,,,,,,,
7792798001309,cerveza STELLA ARTOIS 473cc six pack TER PCK-6-un.,,,,,,,,,,,,,,,,,,,,,,,,,,,,,,,
7792798001316,"CERVEZA NEGRA LATA, QUILMES STOUT, 473 cm3",EAN-13 7792798001316,,,,Quilmes Stout,"Food, Beverages & Tobacco",,,[],,,,,,,,,,,,,,,,,Quilmes stout. Labels: En:no-preservatives. Country of origin: Spain.,[],['https://images.barcodelookup.com/81595/815953753-1.jpg'],2023-10-20 05:43:56,[],[]
7792798001323,"CERVEZA NEGRA LATA SIX PACK, QUILMES STOUT, 2838 cm3",,,,,,,,,,,,,,,,,,,,,,,,,,,,,,,
7792798001712,Pack Cerveza Rubia Golden 473cc 6 Unidades Andes Origen,,,,,,,,,,,,,,,,,,,,,,,,,,,,,,,
7792798001927,Pack X6 Cervezas Kilometro 24.7 Session Ipa Con Sauco 2838 Ml Patagonia,,,,,,,,,,,,,,,,,,,,,,,,,,,,,,,
7792798001934,CERVEZA AMBER LAGER 473 ML X 6 UNI PATAGONIA PAK 2838 ML,,,,,,,,,,,,,,,,,,,,,,,,,,,,,,,
7792798001965,CERVEZA ROJA AMBER LAGER PATAGONIA LATA X 473 CC,,,,,,,,,,,,,,,,,,,,,,,,,,,,,,,
7792798001972,CERVEZA VARIED 24.7KM IPA PATAGONIA LATA X 473CC,EAN-13 7792798001972,,,,24.7,"Food, Beverages & Tobacco",,Patagonia,[],,"Agua, Malta De Cebada, Miel, Jugo De Sauco, Lúpulo",,,,,,,,,473 cm3,,,,,,24.7. Allergens: En:gluten. Country of origin: Argentina.,[],"['https://images.barcodelookup.com/81595/815953755-1.jpg', 'https://images.barcodelookup.com/81595/815953755-2.jpg']",2023-10-20 05:43:56,[],[]
7792798002115,CERVEZA RUBIA RETORNABLE ANDES ORIGEN BOTELLA X1LT,,,,,,,,,,,,,,,,,,,,,,,,,,,,,,,
7792798002122,CERVEZA ROJA RETORNABLE ANDES ORIGEN BOTELLA X 1LT,,,,,,,,,,,,,,,,,,,,,,,,,,,,,,,
7792798002139,cerveza ANDES ORIGEN Negra 1lt Ret BOT-1-lt.,,,,,,,,,,,,,,,,,,,,,,,,,,,,,,,
7792798002153,cerveza ANDES ORIGEN Roja 340cc BOT-340-cc.,,,,,,,,,,,,,,,,,,,,,,,,,,,,,,,
7792798002245,cerveza ANDES LAT 473cc LAT-473-cc.,,,,,,,,,,,,,,,,,,,,,,,,,,,,,,,
7792798002252,cerveza ANDES six pack 473 cc LAT-473-cc.,,,,,,,,,,,,,,,,,,,,,,,,,,,,,,,
7792798002320,cerveza ANDES ORIGEN Negra 473cc LAT-473-cc.,,,,,,,,,,,,,,,,,,,,,,,,,,,,,,,
7792798002337,"CERVEZA MENDOCINA ROJA LATA X6U, ANDES ORIGEN, 2838 cm3",,,,,,,,,,,,,,,,,,,,,,,,,,,,,,,
7792798002344,CERVEZA NEGRA 473 ML X 6 UNI ANDES ORIGEN PAK 2838 ML,,,,,,,,,,,,,,,,,,,,,,,,,,,,,,,
7792798002351,"CERVEZA S/RETORNO AMBER LAGER, PATAGONIA, 730 cm3",,,,,,,,,,,,,,,,,,,,,,,,,,,,,,,
7792798002368,cerveza PATAGONIA Bohemian 740cc BOT-740-cc.,,,,,,,,,,,,,,,,,,,,,,,,,,,,,,,
7792798002375,cerveza PATAGONIA Weisse 730cc BOT-730-cc.,EAN-13 7792798002375,,,,Patagonia Weisse Wheat Beer,"Food, Beverages & Tobacco",,Patagonia,[],,"Agua, Malta De Cebada, Cereales, Malta De Trigo, Lupulo, Extracto Natural De Naranja Y Coriandro",,,,,,,,,730cm²,,,,,,"Patagonia Weisse wheat beer. Labels: En:not-advised-for-pregnant-women. Country of origin: Argentina,Uruguay.",[],"['https://images.barcodelookup.com/81595/815953756-1.jpg', 'https://images.barcodelookup.com/81595/815953756-2.jpg']",2023-10-20 05:43:56,[],[]
7792798002399,Pack X6 Cervezas Kilometro 24.7 En Botella 4380ml Patagonia,EAN-13 7792798002399,,,,Ipa 24.7,"Food, Beverages & Tobacco",,,[],,,,,,,,,,,730,,,,,,Ipa 24.7. Country of origin: Spain.,[],['https://images.barcodelookup.com/81595/815953757-1.jpg'],2023-10-20 05:43:56,[],[]
7792798002566,"CERVEZA AMBER LAGER LATA, PATAGONIA, 473 cm3",,,,,,,,,,,,,,,,,,,,,,,,,,,,,,,
7792798002726,"CERVEZA IPA ANDINA LATA, ANDES ORIGEN, 473 cm3",EAN-13 7792798002726,,,,Andes Origen,"Food, Beverages & Tobacco",,,[],,"Agua, Malta De Cebada, Lupulo, Mosto De Uva",,,,,,,,,,,,,,,Andes Origen. Allergens: En:gluten. Country of origin: Spain.,[],['https://images.barcodelookup.com/81595/815953758-1.jpg'],2023-10-20 05:43:56,[],[]
7792798002757,CERVEZA ORIGEN IPA RETORNABLE ANDES X 1LT,,,,,,,,,,,,,,,,,,,,,,,,,,,,,,,
7792798002788,Cerveza Andes Origen Iparubia Lata 473 ml 6 Unidades,,,,,,,,,,,,,,,,,,,,,,,,,,,,,,,
7792798003563,cerveza PATAGONIA Bohemian 473cc LAT-473-ml.,,,,,,,,,,,,,,,,,,,,,,,,,,,,,,,
7792798003594,cerveza PATAGONIA Bohemian 473cc 6un PCK-6-un.,,,,,,,,,,,,,,,,,,,,,,,,,,,,,,,
7792798003709,Cerveza Corona Porron 330ml X 24 Unidades,EAN-13 7792798003709,,,,Cerveza,"Food, Beverages & Tobacco",,,[],,,,,,,,,,,,,,,,,Cerveza. Country of origin: Argentina.,[],['https://images.barcodelookup.com/81595/815953759-1.jpg'],2023-10-20 05:43:56,[],[]
7792798003716,Pack X12 Cervezas Pale Lager 710 Cc Corona,,,,,,,,,,,,,,,,,,,,,,,,,,,,,,,
7792798003723,"CERVEZA LONG NECK SIX PACK, CORONA, 1980 cu",,,,,,,,,,,,,,,,,,,,,,,,,,,,,,,
7792798003938,CERVEZA BLANCA VERA IPA PATAGONIA LATA X473CC,,,,,,,,,,,,,,,,,,,,,,,,,,,,,,,
7792798003945,Cerveza Patagonia Vera Ipa Neipapajizo Lata 473 ml 6 Unidades,,,,,,,,,,,,,,,,,,,,,,,,,,,,,,,
7792798005086,cerveza HEINEKEN Rubia 473cc sixpack PCK-6-un.,,,,,,,,,,,,,,,,,,,,,,,,,,,,,,,
7792798005888,cerveza BRAHMA Chopp 473cc LAT-473-cc.,EAN-13 7792798005888,,,,Brahma,"Food, Beverages & Tobacco",,,[],,"Ingredientes: Agua, Malta De Cebada, Cereales Lupulo ; En Uruguay, Ingredientes: Gasificante Ins 290",,,,,,,,,473 mL,,,,,,Brahma. Country of origin: Argentina.,[],"['https://images.barcodelookup.com/68226/682267906-1.jpg', 'https://images.barcodelookup.com/68226/682267906-2.jpg', 'https://images.barcodelookup.com/68226/682267906-3.jpg', 'https://images.barcodelookup.com/68226/682267906-4.jpg']",2023-10-20 02:31:27,[],[]
7792798005956,cerveza PATAGONIA Amber 410cc LAT-410-cc.,,,,,,,,,,,,,,,,,,,,,,,,,,,,,,,
7792798005970,Pack 6 Cerveza Brahma Chopp American Adjunct Lager 473ml,,,,,,,,,,,,,,,,,,,,,,,,,,,,,,,
7792798006045,cerveza STELLA ARTOIS 330cc porrón BOT-330-cc.,,,,,,,,,,,,,,,,,,,,,,,,,,,,,,,
7792798006199,CERVEZA STELLA ARTOIS 975 C.C.,,,,,,,,,,,,,,,,,,,,,,,,,,,,,,,
7792798007158,cerveza PATAGONIA Amber Lager 730cc BOT-730-cc.,,,,,,,,,,,,,,,,,,,,,,,,,,,,,,,
7792798007165,cerveza PATAGONIA Bohemian 740cc BOT-740-cc.,,,,,,,,,,,,,,,,,,,,,,,,,,,,,,,
7792798007172,cerveza PATAGONIA Weisse 730cc BOT-730-cc.,,,,,,,,,,,,,,,,,,,,,,,,,,,,,,,
7792798007387,CERVEZA BLANCA CLASICA QUILMES BOTELLA RET X 1 LT,,,,,,,,,,,,,,,,,,,,,,,,,,,,,,,
7792798007400,"CERVEZA NEGRA C/RETORNO, QUILMES STOUT, 1000 cm3",EAN-13 7792798007400,,,,Quilmes Stout 1l,"Food, Beverages & Tobacco",,Quilmes,[],,"Agua, Malta De Cebada, Cereales, Lúpulo, Caramelo Iii 150g",,,,,,,,,1 l,,,,,,Quilmes Stout 1l. Allergens: En:gluten. Packaging: 1 botella de vidrio reutilizable. Country of origin: Argentina.,[],"['https://images.barcodelookup.com/81595/815953767-1.jpg', 'https://images.barcodelookup.com/81595/815953767-2.jpg', 'https://images.barcodelookup.com/81595/815953767-3.jpg']",2023-10-20 05:43:56,[],[]
7792798007424,CERVEZA QUILMES BAJO CERO 1L.,,,,,,,,,,,,,,,,,,,,,,,,,,,,,,,
7792798007431,CERVEZA QUILMES LIEBER 1 LT.,,,,,,,,,,,,,,,,,,,,,,,,,,,,,,,
7792798007493,cerveza BRAHMA Chopp Rubia 1lt Ret BOT-1-lt.,EAN-13 7792798007493,,,,Cerveza Brahma,"Food, Beverages & Tobacco",,,[],,"Agua, Malta De Cebada, Cereales Adjuntos, Lupulo.",,,,,,,,,,,,,,,Cerveza brahma. Allergens: En:gluten. Country of origin: Argentina.,[],['https://images.barcodelookup.com/58688/586887859-1.jpg'],2023-10-20 02:31:27,[],[]
7792798007738,CERVEZA 1890 1L.,,,,,,,,,,,,,,,,,,,,,,,,,,,,,,,
7792798007813,cerveza ANDES Blanca Ret. 1lt BOT-1-lt.,,,,,,,,,,,,,,,,,,,,,,,,,,,,,,,
7792798007844,cerveza STELLA ARTOIS Noire 975cc BOT-975-cc.,,,,,,,,,,,,,,,,,,,,,,,,,,,,,,,
7792798008858,cerveza TEMPLE Wolf Ipa 473cc LAT-473-cc.,EAN-13 7792798008858,,,,Wolf IPA,"Food, Beverages & Tobacco",,Temple,[],,"Agua, Malta De Cebada (malta Munich, Malta Special W, Malta Pilsner) Y LÚpulo (herkules, Cascade, Mosaic)",,,,,,,,,473 cm3,,,,,,Wolf IPA. Allergens: En:gluten. Packaging: 1 lata de aluminio para reciclar. Country of origin: Argentina.,[],"['https://images.barcodelookup.com/81595/815953769-1.jpg', 'https://images.barcodelookup.com/81595/815953769-2.jpg']",2023-10-20 05:43:56,[],[]
7792798008865,cerveza TEMPLE Honey 473cc LAT-473-cc.,EAN-13 7792798008865,,,,Temple,"Food, Beverages & Tobacco",,,[],,,,,,,,,,,,,,,,,Temple. Country of origin: Spain.,[],['https://images.barcodelookup.com/81595/815953770-1.jpg'],2023-10-20 05:43:56,[],[]
7792798008889,cerveza TEMPLE Wolf Ipa 473cc Six pack PCK-6-un.,,,,,,,,,,,,,,,,,,,,,,,,,,,,,,,
7792798008896,cerveza TEMPLE Honey 473cc Six pack PCK-6-un.,,,,,,,,,,,,,,,,,,,,,,,,,,,,,,,
7792798009107,CERVEZA SIN ALCOHOL 0.0% QUILMES LAT 473 ML,EAN-13 7792798009107,,,,"0,0% Sin Alcohol","Food, Beverages & Tobacco",,Quilmes,[],,"Agua, Malta De Cebada, Maíz, Lúpulo",,,,,,,,,473 cm3,,,,,,"0,0% Sin alcohol. Labels: En:no-preservatives. Country of origin: Argentina.",[],"['https://images.barcodelookup.com/81595/815953771-1.jpg', 'https://images.barcodelookup.com/81595/815953771-2.jpg']",2023-10-20 05:43:56,[],[]
7792798009114,"CERVEZA SIN ALCOHOL 0.0% QUILMES PACK X6 UNID 2,84 ML",,,,,,,,,,,,,,,,,,,,,,,,,,,,,,,
7792798009312,cerveza STELLA ARTOIS Noire 473cc LAT-473-ml.,,,,,,,,,,,,,,,,,,,,,,,,,,,,,,,
7792798009343,cerveza TEMPLE Scottish 473cc Six pack PCK-6-un.,,,,,,,,,,,,,,,,,,,,,,,,,,,,,,,
7792798009350,cerveza TEMPLE Scottish 473cc LAT-473-cc.,EAN-13 7792798009350,,,,Scottish Temple Cerveza,"Food, Beverages & Tobacco",,,[],,,,,,,,,,,473,,,,,,Scottish temple cerveza. Country of origin: Spain.,[],['https://images.barcodelookup.com/81595/815953773-1.jpg'],2023-10-20 05:43:56,[],[]
7792798009428,cerveza STELLA ARTOIS Noire 473cc 6un PCK-6-un.,,,,,,,,,,,,,,,,,,,,,,,,,,,,,,,
7792798010561,cerveza STELLA ARTOIS P. Malta 975cc Ret BOT-975-cc.,,,,,,,,,,,,,,,,,,,,,,,,,,,,,,,
7792798010578,Pack X24 Cervezas Belgium Rubia 330ml Cada Una Stella Artois,EAN-13 7792798010578,,,,Stella,"Food, Beverages & Tobacco",,,[],,,,,,,,,,,330,,,,,,Stella. Country of origin: Spain.,[],[],2023-10-20 02:31:27,[],[]
7792798010592,Cerveza Stella Artois Premium Lagerrubia Lata 473 ml 6 Unidades,,,,,,,,,,,,,,,,,,,,,,,,,,,,,,,
7792798010615,cerveza STELLA ARTOIS Rubia 473cc LAT-473-cc.,,,,,,,,,,,,,,,,,,,,,,,,,,,,,,,
7792798010639,CERVEZA NEGRA STELLA ARTOIS NOIRE LATA X 473 CC,EAN-13 7792798010639,,,,Stella Noire,"Food, Beverages & Tobacco",,,[],,,,,,,,,,,,,,,,,Stella noire. Country of origin: Spain.,[],['https://images.barcodelookup.com/81595/815953782-1.jpg'],2023-10-20 05:43:56,[],[]
